[
  {
    "uid": "a1b2c3d4e5f60718293a4b5c6d7e8f9012345678",
    "name": "Finns Beach Club Sunset Sessions",
    "location": "Finns Beach Club, Canggu",
    "description": "Open-air DJ set and sunset dance session overlooking Berawa Beach. Verify with organizer.",
    "start_utc": "2026-10-12T10:00:00Z",
    "finish_utc": "2026-10-12T14:00:00Z",
    "area": "Canggu",
    "category": "Music",
    "cost": "IDR 200K",
    "free": false,
    "source_url": "https://example.com/events/finns-sunset-sessions",
    "source": "dummy_manual",
    "status": "confirmed"
  },
  {
    "uid": "b2c3d4e5f60718293a4b5c6d7e8f901234567890",
    "name": "Dojo Bali Startup Pitch Night",
    "location": "Dojo Bali, Canggu",
    "description": "Weekly coworking pitch night: five local startups, open networking after. Verify with organizer.",
    "start_utc": "2026-10-13T11:00:00Z",
    "finish_utc": "2026-10-13T13:30:00Z",
    "area": "Canggu",
    "category": "Coworking & Tech",
    "cost": "Free entry",
    "free": true,
    "source_url": "https://example.com/events/dojo-pitch-night",
    "source": "dummy_manual",
    "status": "confirmed"
  },
  {
    "uid": "c3d4e5f60718293a4b5c6d7e8f90123456789012",
    "name": "Potato Head Sunset Dinner & Tasting Menu",
    "location": "Potato Head Beach Club, Seminyak",
    "description": "Five-course Indonesian tasting menu with live acoustic set. Verify with organizer.",
    "start_utc": "2026-10-12T11:00:00Z",
    "finish_utc": "2026-10-12T14:00:00Z",
    "area": "Seminyak",
    "category": "Food & Drink",
    "cost": "IDR 450K",
    "free": false,
    "source_url": "https://example.com/events/potato-head-tasting",
    "source": "dummy_manual",
    "status": "confirmed"
  },
  {
    "uid": "d4e5f60718293a4b5c6d7e8f9012345678901234",
    "name": "La Favela Late Night Fiesta",
    "location": "La Favela, Seminyak",
    "description": "Timed evening party: Latin beats, costume dancers, doors at 11pm WITA. Verify with organizer.",
    "start_utc": "2026-10-13T15:00:00Z",
    "finish_utc": "2026-10-13T19:00:00Z",
    "area": "Seminyak",
    "category": "Nightlife",
    "cost": "IDR 150K",
    "free": false,
    "source_url": "https://example.com/events/la-favela-fiesta",
    "source": "dummy_manual",
    "status": "confirmed"
  },
  {
    "uid": "e5f60718293a4b5c6d7e8f901234567890123456",
    "name": "Savaya Uluwatu Cliffside DJ Night",
    "location": "Savaya, Uluwatu",
    "description": "International headliner on the clifftop stage above the ocean. Verify with organizer.",
    "start_utc": "2026-10-14T11:00:00Z",
    "finish_utc": "2026-10-14T16:00:00Z",
    "area": "Uluwatu",
    "category": "Music",
    "cost": "IDR 350K",
    "free": false,
    "source_url": "https://example.com/events/savaya-dj-night",
    "source": "dummy_manual",
    "status": "confirmed"
  },
  {
    "uid": "f60718293a4b5c6d7e8f90123456789012345678",
    "name": "Padang Padang Surf Cup Heats",
    "location": "Padang Padang Beach, Uluwatu",
    "description": "Morning competition heats with local and visiting surfers; spectators welcome. Verify with organizer.",
    "start_utc": "2026-10-15T00:00:00Z",
    "finish_utc": "2026-10-15T05:00:00Z",
    "area": "Uluwatu",
    "category": "Surf",
    "cost": "Free for spectators",
    "free": true,
    "source_url": "https://example.com/events/padang-surf-cup",
    "source": "dummy_manual",
    "status": "confirmed"
  },
  {
    "uid": "0718293a4b5c6d7e8f9012345678901234567890",
    "name": "Morning Breathwork at Ubud Yoga Barn",
    "location": "Ubud Yoga Barn, Ubud",
    "description": "Guided breathwork and gentle flow, all levels welcome, mats provided. Verify with organizer.",
    "start_utc": "2026-10-13T01:00:00Z",
    "finish_utc": "2026-10-13T02:30:00Z",
    "area": "Ubud",
    "category": "Wellness",
    "cost": "Free entry",
    "free": true,
    "source_url": "https://example.com/events/yoga-barn-breathwork",
    "source": "dummy_manual",
    "status": "confirmed"
  },
  {
    "uid": "18293a4b5c6d7e8f9012345678901234567890ab",
    "name": "Balinese Legong Dance Evening",
    "location": "ARMA Museum, Ubud",
    "description": "Traditional Legong and Barong dance performance with gamelan orchestra. Verify with organizer.",
    "start_utc": "2026-10-15T11:30:00Z",
    "finish_utc": "2026-10-15T13:30:00Z",
    "area": "Ubud",
    "category": "Arts & Culture",
    "cost": "IDR 100K",
    "free": false,
    "source_url": "https://example.com/events/arma-legong-dance",
    "source": "dummy_manual",
    "status": "confirmed"
  },
  {
    "uid": "293a4b5c6d7e8f9012345678901234567890abcd",
    "name": "Denpasar Tech Talk & Coworking Mixer",
    "location": "Kumpul Coworking, Denpasar",
    "description": "Lightning talks on remote work plus open coworking mixer. Verify with organizer.",
    "start_utc": "2026-10-14T09:00:00Z",
    "finish_utc": "2026-10-14T11:00:00Z",
    "area": "Denpasar",
    "category": "Coworking & Tech",
    "cost": "Free entry",
    "free": true,
    "source_url": "https://example.com/events/denpasar-tech-mixer",
    "source": "dummy_manual",
    "status": "confirmed"
  },
  {
    "uid": "3a4b5c6d7e8f9012345678901234567890abcdef",
    "name": "Denpasar Night Market Food Tour",
    "location": "Pasar Kreneng Night Market, Denpasar",
    "description": "Guided street-food walk: babi guling, sate lilit, and local desserts. Verify with organizer.",
    "start_utc": "2026-10-16T10:00:00Z",
    "finish_utc": "2026-10-16T13:00:00Z",
    "area": "Denpasar",
    "category": "Food & Drink",
    "cost": "IDR 125K",
    "free": false,
    "source_url": "https://example.com/events/kreneng-food-tour",
    "source": "dummy_manual",
    "status": "confirmed"
  },
  {
    "uid": "4b5c6d7e8f9012345678901234567890abcdef01",
    "name": "Tanah Lot Sunrise Yoga Flow",
    "location": "Tanah Lot Temple Park, Tabanan",
    "description": "Sunrise vinyasa session near the temple gardens, breakfast included. Verify with organizer.",
    "start_utc": "2026-10-16T22:00:00Z",
    "finish_utc": "2026-10-16T23:30:00Z",
    "area": "Tabanan",
    "category": "Wellness",
    "cost": "IDR 180K",
    "free": false,
    "source_url": "https://example.com/events/tanah-lot-yoga",
    "source": "dummy_manual",
    "status": "confirmed"
  },
  {
    "uid": "5c6d7e8f9012345678901234567890abcdef0123",
    "name": "Jatiluwih Rice Terrace Harvest Festival",
    "location": "Jatiluwih Rice Terraces, Tabanan",
    "description": "All-day harvest celebration: folk music, rice pounding demos, and local stalls. Verify with organizer.",
    "start_utc": "2026-10-14T00:00:00Z",
    "finish_utc": "2026-10-15T00:00:00Z",
    "area": "Tabanan",
    "category": "Arts & Culture",
    "cost": "Free entry",
    "free": true,
    "source_url": "https://example.com/events/jatiluwih-harvest-festival",
    "source": "dummy_manual",
    "status": "confirmed"
  },
  {
    "uid": "6d7e8f9012345678901234567890abcdef012345",
    "name": "Secret Pop-Up Party (venue TBA)",
    "location": "Somewhere in Bali (venue to be announced)",
    "description": "Vague listing: promoter promises a venue drop on the day. Details unconfirmed. Verify with organizer.",
    "start_utc": "2026-10-17T12:00:00Z",
    "finish_utc": "2026-10-17T16:00:00Z",
    "area": "Other",
    "category": "Nightlife",
    "cost": "IDR 250K",
    "free": false,
    "source_url": "https://example.com/events/secret-popup-party",
    "source": "dummy_manual",
    "status": "needs_review"
  },
  {
    "uid": "7e8f9012345678901234567890abcdef01234567",
    "name": "Bali Island Jazz & Food Fair",
    "location": "Nusa Dua Festival Grounds (touring stop)",
    "description": "Multi-day open-air fair: jazz line-ups, surf films, and food stalls across three days. Verify with organizer.",
    "start_utc": "2026-10-16T02:00:00Z",
    "finish_utc": "2026-10-18T12:00:00Z",
    "area": "Other",
    "category": "Music",
    "cost": "IDR 500K weekend pass",
    "free": false,
    "source_url": "https://example.com/events/island-jazz-food-fair",
    "source": "dummy_manual",
    "status": "confirmed"
  }
]
